original_text,shared_sentences,unique_to_spacy,unique_to_nltk,nltk_segmentation,spacy_segmentation
,The medieval castle of Petit Marsac stands on the top of the cliff just above the shelter.,"It was the first exposition to be based on the future, with an opening slogan of ""Dawn of a New Day"", and it allowed all visitors to take a look at ""the world of tomorrow"".
","His book, Experiencing Art: In the Brain of the Beholder, explores the perceptual, conceptual, and emotional features that guide our encounters with art (e.g., paintings and photography).",Notable postdoctoral fellows she supervised included Nancy Kanwisher and Nilli Lavie.,The medieval castle of Petit Marsac stands on the top of the cliff just above the shelter.
,"Treisman researched visual attention, object perception, and memory.",[imposing] a ban on all flights in the country's airspace — a no-fly zone — and tightened sanctions on the Muammar Gaddafi regime and its supporters.,"Shimamura's research explored other psychological phenomenon, such as visual illusions (The Mystery Spot), aging in UC Berkeley Professors, and emotions in facial expressions.In 2017, he published Get SMART!","During her long career, Treisman experimentally and theoretically defined the issue of how information is selected and integrated to form meaningful objects that guide human thought and action.","Treisman researched visual attention, object perception, and memory."
,"One of her most influential ideas is the feature integration theory of attention, first published with Garry Gelade in 1980.","""American","Five Steps Toward a Healthy Brain, a self-help book that offers guidelines for healthy aging and lifelong learning.","A special election for one judge of the International Criminal Court was held during the 12th session of the Assembly of States Parties to the Rome Statute of the International Criminal Court which took place in The Hague from 20 to 28 November 2013.The election became necessary after one judge elected in the 2011 election was unavailable: Anthony Carmona had been elected President of Trinidad and Tobago and had resigned from the bench on 18 March 2013.Geoffrey A. Henderson, also from Trinidad and Tobago, was elected in the first ballot after his only opponent had withdrawn.","One of her most influential ideas is the feature integration theory of attention, first published with Garry Gelade in 1980."
,"Treisman taught at the University of Oxford, University of British Columbia, University of California, Berkeley, and Princeton University.","and British naval forces fired over 110 Tomahawk cruise missiles, and imposed a naval blockade.",It is a structure composed of nervous tissue positioned along the rostral (nose end) to caudal (tail end) axis of the body and may have an enlarged section at the rostral end which is a brain.,"Autobiographical memory (AM) is a memory system consisting of episodes recollected from an individual's life, based on a combination of episodic (personal experiences and specific objects, people and events experienced at particular time and place) and semantic (general knowledge and facts about the world) memory.","Treisman taught at the University of Oxford, University of British Columbia, University of California, Berkeley, and Princeton University."
,"In 2013, Treisman received the National Medal of Science from President Barack Obama for her pioneering work in the study of attention.","The Libyan government's response to the campaign was totally ineffectual, with Gaddafi's forces not managing to shoot down a single NATO plane, despite the country possessing 30 heavy SAM batteries, 17 medium SAM batteries, 55 light SAM batteries (a total of 400–450 launchers, including 130–150 2K12 Kub launchers and some 9K33 Osa launchers), and 440–600 short-ranged air-defense guns.",His tenure begins on 13 September 2016.,Animal cognition encompasses the mental capacities of non-human animals including insect cognition.,"In 2013, Treisman received the National Medal of Science from President Barack Obama for her pioneering work in the study of attention."
,"During her long career, Treisman experimentally and theoretically defined the issue of how information is selected and integrated to form meaningful objects that guide human thought and action.",The official names for the interventions by the coalition members are Opération Harmattan by France;,"The model asserts that human memory has three separate components: 

a sensory register, where sensory information enters memory,
a short-term store, also called working memory or short-term memory, which receives and holds input from both the sensory register and the long-term store, and
a long-term store, where information which has been rehearsed (explained below) in the short-term store is held indefinitely.Since its first publication, this model has come under much scrutiny and has been criticized for various reasons (described below).",The study of animal conditioning and learning used in this field was developed from comparative psychology.,"During her long career, Treisman experimentally and theoretically defined the issue of how information is selected and integrated to form meaningful objects that guide human thought and action."
,"Autobiographical memory (AM) is a memory system consisting of episodes recollected from an individual's life, based on a combination of episodic (personal experiences and specific objects, people and events experienced at particular time and place) and semantic (general knowledge and facts about the world) memory.","From the beginning of the intervention, the initial coalition of Belgium, Canada, Denmark, France, Italy, Norway, Qatar, Spain, UK and US expanded to nineteen states, with newer states mostly enforcing the no-fly zone and naval blockade or providing military logistical assistance.","Acheulean (; also Acheulian and Mode II), from the French acheuléen after the type site of Saint-Acheul, is an archaeological industry of stone tool manufacture characterized by the distinctive oval and pear-shaped ""hand axes"" associated with Homo erectus and derived species such as Homo heidelbergensis.",An ordinary election for the first full bench of 18 judges of the International Criminal Court was held during the first resumption of the 1st session of the Assembly of States Parties to the Rome Statute of the International Criminal Court in New York between 3 and 7 February 2003.,"Autobiographical memory (AM) is a memory system consisting of episodes recollected from an individual's life, based on a combination of episodic (personal experiences and specific objects, people and events experienced at particular time and place) and semantic (general knowledge and facts about the world) memory."
,It is thus a type of explicit memory.,"NATO flew 26,500 sorties since it took charge of the Libya mission on 31 March 2011.
","It is thought that Acheulean technologies first developed about 1.76 million years ago, derived from the more primitive Oldowan technology associated with Homo habilis.",African coral reefs are the coral reefs which are present in Africa.,It is thus a type of explicit memory.
,Animal cognition encompasses the mental capacities of non-human animals including insect cognition.,"Libya's new government requested that its mission be extended to the end of the year, but on 27 October, the Security Council unanimously voted to end NATO's mandate for military action on 31 October.","The Agat World War II Amtrac is an underwater relic of World War II, located off Ga'an Point in Agat Bay on the west side of the island of Guam.",Most are found along the eastern and southern coasts of Africa.,Animal cognition encompasses the mental capacities of non-human animals including insect cognition.
,The study of animal conditioning and learning used in this field was developed from comparative psychology.,"It is reported that over the eight months, NATO members carried out 7,000 bombing sorties targeting Gaddafi's forces.","It is the remains of an LVT 4, an amphibious tracked landing vehicle.","The east coast corals extend from the Red Sea to Madagascar in the south, and are an important resource for the fishersmen of Kenya, Tanzania, Mozambique and Madagascar.",The study of animal conditioning and learning used in this field was developed from comparative psychology.
,"It has also been strongly influenced by research in ethology, behavioral ecology, and evolutionary psychology;  the alternative name cognitive ethology is sometimes used.","Artificial neural networks (ANNs), usually simply called neural networks (NNs) or neural nets, are computing systems inspired by the biological neural networks that constitute animal brains.","It is located about 500 yards (460 m) off Agat Invasion Beach in 45 feet (14 m) of water, and was described as being in good condition when it was discovered and surveyed in 1985.","Some cold-water reefs are also found along the northwestern part of Africa, i.e.","It has also been strongly influenced by research in ethology, behavioral ecology, and evolutionary psychology;  the alternative name cognitive ethology is sometimes used."
,An ordinary election for the first full bench of 18 judges of the International Criminal Court was held during the first resumption of the 1st session of the Assembly of States Parties to the Rome Statute of the International Criminal Court in New York between 3 and 7 February 2003.,then processes them and can signal neurons connected to it.,"However, five of every six farms in the world consist of less than two hectares and take up only around 12 percent of all agricultural land.The major agricultural products can be broadly grouped into foods, fibers, fuels, and raw materials (such as rubber).",An ordinary election for six judges of the International Criminal Court was held during the resumption of the 4th session of the Assembly of States Parties to the Rome Statute of the International Criminal Court in New York on 26 January 2006.,An ordinary election for the first full bench of 18 judges of the International Criminal Court was held during the first resumption of the 1st session of the Assembly of States Parties to the Rome Statute of the International Criminal Court in New York between 3 and 7 February 2003.
,Most are found along the eastern and southern coasts of Africa.,Boris Khodorov (Russian:,Al Munassir was an amphibious warfare vessel operated by the Royal Navy of Oman.,It was formulated and advanced by American philosopher Charles Sanders Peirce beginning in the last third of the 19th century.,Most are found along the eastern and southern coasts of Africa.
,"It crosses the Atlantic Ocean, Africa, the Indian Ocean, Australasia, the Pacific Ocean and South America.",Всесоюзное Физиологическое общество имени И. П. Павлова).,"Moreover, this was the first election of Kazakhstan to the Council.",Diagnostic expert systems frequently employ abduction.,"It crosses the Atlantic Ocean, Africa, the Indian Ocean, Australasia, the Pacific Ocean and South America."
,An ordinary election for six judges of the International Criminal Court was held during the resumption of the 4th session of the Assembly of States Parties to the Rome Statute of the International Criminal Court in New York on 26 January 2006.,"He has published over 100 scientific articles and chapters, was a founding member of the Cognitive Neuroscience Society, and has been science advisor for the San Francisco Exploratorium science museum.
",This conditioning is intended to cause the patient to associate the stimulus with unpleasant sensations with the intention of quelling the targeted (sometimes compulsive) behavior.,Six judges of the International Criminal Court were elected during the 13th session of the Assembly of States Parties to the Rome Statute of the International Criminal Court scheduled for 8 to 17 December 2014 in New York.,An ordinary election for six judges of the International Criminal Court was held during the resumption of the 4th session of the Assembly of States Parties to the Rome Statute of the International Criminal Court in New York on 26 January 2006.
,"Abductive reasoning (also called abduction, abductive inference, or retroduction) is a form of logical inference that seeks the simplest and most likely conclusion from a set of observations.","His book, Experiencing Art:","Aversion therapies can take many forms, for example: placing unpleasant-tasting substances on the fingernails to discourage nail-chewing; pairing the use of an emetic with the experience of alcohol; or pairing behavior with electric shocks of mild to higher intensities.",The judges were elected for terms of nine years and took office on 11 March 2015.,"Abductive reasoning (also called abduction, abductive inference, or retroduction) is a form of logical inference that seeks the simplest and most likely conclusion from a set of observations."
,"Abductive reasoning, unlike deductive reasoning, yields a plausible conclusion but does not definitively verify it.","In 2013, Shimamura edited a volume, Psychocinematics: Exploring Cognition at the Movies, which introduces psychocinematics, the term he coined for scientific investigations of the psychological and biological features of film.
","The Akkadian Empire exercised influence across Mesopotamia, the Levant, and Anatolia, sending military expeditions as far south as Dilmun and Magan (modern Saudi Arabia, Bahrain, and Oman) in the Arabian Peninsula.The Akkadian Empire reached its political peak between the 24th and 22nd centuries BC, following the conquests by its founder Sargon of Akkad.","This is in contrast to retrograde amnesia, where memories created prior to the event are lost while new memories can still be created.","Abductive reasoning, unlike deductive reasoning, yields a plausible conclusion but does not definitively verify it."
,"Abductive conclusions do not eliminate uncertainty or doubt, which is expressed in retreat terms such as ""best available"" or ""most likely"".","Shimamura's research explored other psychological phenomenon, such as visual illusions (The Mystery Spot), aging in UC Berkeley Professors, and emotions in facial expressions.","However, the two campaigns offset each other, and the selection was won by the only candidate who was neither female nor from Eastern Europe.",Both can occur together in the same patient.,"Abductive conclusions do not eliminate uncertainty or doubt, which is expressed in retreat terms such as ""best available"" or ""most likely""."
,Diagnostic expert systems frequently employ abduction.,"Toward a Healthy Brain, a self-help book that offers guidelines for healthy aging and lifelong learning.","This temple, built by Chola emperor Rajaraja II in the 12th century CE is a UNESCO World Heritage Site, along with the Brihadeeswara Temple at Thanjavur, the Gangaikondacholisvaram Temple at Gangaikonda Cholapuram that are referred to as the Great Living Chola Temples.The Airavatesvarar temple is one among a cluster of eighteen medieval era large Hindu temples in the Kumbakonam area, Thanjavur District.","For example, an agent (such as a mouse in the figure) is exposed to a light (the first conditioned stimulus, CS1), together with food (the unconditioned stimulus, US).",Diagnostic expert systems frequently employ abduction.
,Six judges of the International Criminal Court were elected during the 13th session of the Assembly of States Parties to the Rome Statute of the International Criminal Court scheduled for 8 to 17 December 2014 in New York.,It is a structure composed of nervous tissue positioned along the rostral (nose end) to caudal (tail end),"It also reverentially displays Vaishnavism and Shaktism traditions of Hinduism, along with the legends associated with Nayanmars – the Bhakti movement saints of Shaivism.The stone temple incorporates a chariot structure, and includes major Vedic and Puranic deities such as Indra, Agni, Varuna, Vayu, Brahma, Surya, Vishnu, Saptamtrikas, Durga, Saraswati, Sri devi (Lakshmi), Ganga, Yamuna, Subrahmanya, Ganesha, Kama, Rati and others.","After repeated pairings of CS1 and US, the agent salivates when the light comes on (conditioned response, CR).",Six judges of the International Criminal Court were elected during the 13th session of the Assembly of States Parties to the Rome Statute of the International Criminal Court scheduled for 8 to 17 December 2014 in New York.
,The judges were elected for terms of nine years and took office on 11 March 2015.,axis of the body and may have an enlarged section at the rostral end which is a brain.,"Amnesty is increasingly used to express the idea of ""freedom"" and to refer to when prisoners can go free.","Then, there are more conditioning trials, this time with the light (CS1) and a tone (CS2) together with the US.",The judges were elected for terms of nine years and took office on 11 March 2015.
,"In neurology, anterograde amnesia is the inability to create new memories after the event that caused amnesia, leading to a partial or complete inability to recall the recent past, while long-term memories from before the event remain intact.","Only arthropods, cephalopods and vertebrates have a true brain (precursor structures exist in onychophorans, gastropods and lancelets).
","Other famous amnesties include: Napoleon's amnesty of March 13, 1815, from which thirteen eminent persons, including Talleyrand, were exempt; the Prussian amnesty of August 10, 1840; the general amnesty proclaimed by the emperor Franz Josef I of Austria in 1857; the general amnesty granted by President of the United States, Andrew Johnson, after the American Civil War (1861–1865), in 1868, and the French amnesty of 1905.","Now, when tested, the agent does not salivate to the tone (CS2).","In neurology, anterograde amnesia is the inability to create new memories after the event that caused amnesia, leading to a partial or complete inability to recall the recent past, while long-term memories from before the event remain intact."
,"This is in contrast to retrograde amnesia, where memories created prior to the event are lost while new memories can still be created.","His tenure begins on 13 September 2016.

 ","Anatoly Zubkov (Russian: Анатолий Анатольевич Зубков; 1900–1967) was a Soviet physiologist, D.Sc.","In other words, an association between the tone CS2 and the US has been ""blocked"" because the CS1–US association already exists.","This is in contrast to retrograde amnesia, where memories created prior to the event are lost while new memories can still be created."
,Both can occur together in the same patient.,"The model asserts that human memory has three separate components: 

a sensory register, where sensory information enters memory,
a short-term store, also called working memory or short-term memory, which receives and holds input from both the sensory register and the long-term store, and
a long-term store, where information which has been rehearsed (explained below) in the short-term store is held indefinitely.","Although behaviorists generally accept the important role of heredity in determining behavior, they focus primarily on environmental events.",This effect was most famously explained by the Rescorla–Wagner model.,Both can occur together in the same patient.
,"To a large degree, anterograde amnesia remains a mysterious ailment because the precise mechanism of storing memories is not yet well understood, although it is known that the regions of the brain involved are certain sites in the temporal cortex, especially in the hippocampus and nearby subcortical regions.","Since its first publication, this model has come under much scrutiny and has been criticized for various reasons (described below).  ","Behaviorism emerged in the early 1900s as a reaction to depth psychology and other traditional forms of psychology, which often had difficulty making predictions that could be tested experimentally, but derived from earlier research in the late nineteenth century, such as when Edward Thorndike pioneered the law of effect, a procedure that involved the use of consequences to strengthen or weaken behavior.","The model says, essentially, that if one CS (here the light) already fully predicts that the US will come, nothing will be learned about a second CS (here the tone) that accompanies the first CS.","To a large degree, anterograde amnesia remains a mysterious ailment because the precise mechanism of storing memories is not yet well understood, although it is known that the regions of the brain involved are certain sites in the temporal cortex, especially in the hippocampus and nearby subcortical regions."
,"For example, an agent (such as a mouse in the figure) is exposed to a light (the first conditioned stimulus, CS1), together with food (the unconditioned stimulus, US).","The 2010 census showed a population of 1,310 inhabitants.","Aplysia () is a genus of medium-sized to extremely large sea slugs, specifically sea hares, which are a kind of marine gastropod mollusk.","Ala (also known as Ani, Ana, Ale, and Ali in varying Igbo dialects) is the female Alusi (deity) of the earth, morality, fertility, and creativity in Odinani.","For example, an agent (such as a mouse in the figure) is exposed to a light (the first conditioned stimulus, CS1), together with food (the unconditioned stimulus, US)."
,"After repeated pairings of CS1 and US, the agent salivates when the light comes on (conditioned response, CR).","Akumal is famous as a destination for snorkeling, where visitors can swim with endangered green sea turtles, who visit the shallow bay to feed on sea grass.  ","They graze in tidal and subtidal zones of tropical waters, mostly in the Indo-Pacific Ocean (23 species); but they can also be found in the Atlantic Ocean (12 species), with a few species occurring in the Mediterranean.","In Odinani, Ala rules over the underworld and holds the deceased ancestors in her womb.","After repeated pairings of CS1 and US, the agent salivates when the light comes on (conditioned response, CR)."
,This effect was most famously explained by the Rescorla–Wagner model.,"It is the remains of an LVT 4, an amphibious tracked landing vehicle.  ","Shupyk National Medical Academy of Postgraduate Education, and the A. P. Romodanov Institute of Neurosurgery, he lectured at the Lviv Polytechnic, and worked at the government of Ukraine as an adviser to Oleksandr Turchynov.He claimed to have set several world records in mnemonics by memorizing data and figures (such as pi) and performing complex calculations in his mind.","As the goddess of morality, Ala is involved in judging human actions and is in charge of Igbo law and customs known as omenala.",This effect was most famously explained by the Rescorla–Wagner model.
,"The model says, essentially, that if one CS (here the light) already fully predicts that the US will come, nothing will be learned about a second CS (here the tone) that accompanies the first CS.","It is located about 500 yards (460 m) off Agat Invasion Beach in 45 feet (14 m) of water, and was described as being in good condition when it was discovered and surveyed in 1985.  ","Because of this, he is known as ""Doctor Pi"".Slyusarchuk defrauded two Ukrainian presidents: Viktor Yushchenko and Viktor Yanukovych.",Taboos and crimes among Igbo communities that are against the standard of Ala are called nsọ Ala. All ground is considered holy land as it is Ala herself.,"The model says, essentially, that if one CS (here the light) already fully predicts that the US will come, nothing will be learned about a second CS (here the tone) that accompanies the first CS."
,Blocking is an outcome of other models that also base learning on the difference between what is predicted and what actually happens.,"These vehicles were used during the 1944 Battle of Guam, in which American forces recaptured the island from occupying Japanese forces.  ","It can have three different causes:

a low level of attention (""blanking"" or ""zoning out"")
intense attention to a single object of focus (hyperfocus) that makes a person oblivious to events around them;
unwarranted distraction of attention from the object of focus by irrelevant thoughts or environmental events.Absent-mindedness is a mental condition in which the subject experiences low levels of attention and frequent distraction.","With human fertility, Ala is credited for the productivity of the land.",Blocking is an outcome of other models that also base learning on the difference between what is predicted and what actually happens.
,"Ala (also known as Ani, Ana, Ale, and Ali in varying Igbo dialects) is the female Alusi (deity) of the earth, morality, fertility, and creativity in Odinani.","In the twentieth century, industrial agriculture based on large-scale monocultures came to dominate agricultural output.
",The vessel is owned by Shenzhen Energy Transport Co. Ltd.The ship was more than 10 km outside the shipping lane.,"Ala's messenger and living agent on earth is the python (Igbo: éké), which is especially revered in many Igbo communities.","Ala (also known as Ani, Ana, Ale, and Ali in varying Igbo dialects) is the female Alusi (deity) of the earth, morality, fertility, and creativity in Odinani."
,"In Odinani, Ala rules over the underworld and holds the deceased ancestors in her womb.","However, five of every six farms in the world consist of less than two hectares and take up only around 12 percent of all agricultural land.",The ship's captain and officer-on-watch were both charged.,"In art, Ala is often represented as a regal figure seated on a throne, surrounded by her family.","In Odinani, Ala rules over the underworld and holds the deceased ancestors in her womb."
