original_text,shared_sentences,unique_to_spacy,unique_to_nltk,nltk_segmentation,spacy_segmentation
,The 22nd parallel south is a circle of latitude that is 22 degrees south of the Earth's equatorial plane.,,,Cognitive behavioral therapy is one of the most effective means of treatment for substance abuse and co-occurring mental health disorders.,The 22nd parallel south is a circle of latitude that is 22 degrees south of the Earth's equatorial plane.
,"A section of the border between Namibia and Botswana, and two sections of the border between Bolivia and Argentina are defined by the parallel.",,,"Though it was originally designed to treat depression, its uses have been expanded to include the treatment of many mental health conditions, including anxiety, substance use disorders, marital problems, and eating disorders.","A section of the border between Namibia and Botswana, and two sections of the border between Bolivia and Argentina are defined by the parallel."
,"The 2016 United Nations Security Council election was held on 28 June during the 70th session of the United Nations General Assembly, held at United Nations Headquarters in New York City.",,,CBT includes a number of cognitive or behavioral psychotherapies that treat defined psychopathologies using evidence-based techniques and strategies.CBT is a common form of talk therapy based on the combination of the basic principles from behavioral and cognitive psychology.,"The 2016 United Nations Security Council election was held on 28 June during the 70th session of the United Nations General Assembly, held at United Nations Headquarters in New York City."
,This was the first time a Security Council election was held in the month of June.,,,Researchers have found that other bona fide therapeutic interventions were equally effective for treating certain conditions in adults.,This was the first time a Security Council election was held in the month of June.
,"On 18 September 2014, the General Assembly adopted Resolution 68/307 to push the elections back to six months prior to the beginning of the newly elected Council members' terms.",,,"Along with interpersonal psychotherapy (IPT), CBT is recommended in treatment guidelines as a psychosocial treatment of choice.","On 18 September 2014, the General Assembly adopted Resolution 68/307 to push the elections back to six months prior to the beginning of the newly elected Council members' terms."
,Aversion therapy is a form of psychological treatment in which the patient is exposed to a stimulus while simultaneously being subjected to some form of discomfort.,,,"This temple, built by Chola emperor Rajaraja II in the 12th century CE is a UNESCO World Heritage Site, along with the Brihadeeswara Temple at Thanjavur, the Gangaikondacholisvaram Temple at Gangaikonda Cholapuram that are referred to as the Great Living Chola Temples.The Airavatesvarar temple is one among a cluster of eighteen medieval era large Hindu temples in the Kumbakonam area, Thanjavur District.",Aversion therapy is a form of psychological treatment in which the patient is exposed to a stimulus while simultaneously being subjected to some form of discomfort.
,"Aversion therapy, when used in a nonconsensual manner, is widely considered to be inhumane.",,,Shiva's consort has a dedicated shrine called the Periya Nayaki Amman temple.,"Aversion therapy, when used in a nonconsensual manner, is widely considered to be inhumane."
,"At the Judge Rotenberg Educational Center, aversion therapy is used to perform behavior modification in students as part of the center's applied behavioral analysis program.",,,This is a detached temple situated to the north of the Airavateshvarar temple.,"At the Judge Rotenberg Educational Center, aversion therapy is used to perform behavior modification in students as part of the center's applied behavioral analysis program."
,The center has been condemned by the United Nations for torture.,,,This might have been a part of the main temple when the outer courts were complete.,The center has been condemned by the United Nations for torture.
,"A Treatise on Painting (Trattato della pittura) is a collection of Leonardo da Vinci's writings entered in his notebooks under the general heading ""On Painting"".",,,"At present, parts of the temple such as the gopuram is in ruins, and the main temple and associated shrines stand alone.","A Treatise on Painting (Trattato della pittura) is a collection of Leonardo da Vinci's writings entered in his notebooks under the general heading ""On Painting""."
,The manuscripts were begun in Milan while Leonardo was under the service of Ludovico Sforza and gathered together by his heir Francesco Melzi.,,,It has two sun dials namely morning and evening sun dials which  can be seen as wheels of the chariot.,The manuscripts were begun in Milan while Leonardo was under the service of Ludovico Sforza and gathered together by his heir Francesco Melzi.
,An abridged version of the treatise was first published in France in 1651.,,,"The temple continues to attract large gatherings of Hindu pilgrims every year during Magha, while some of the images such as those of Durga and Shiva are part of special pujas.",An abridged version of the treatise was first published in France in 1651.
,"After Melzi's  manuscript was rediscovered in the Vatican Library, the treatise was published in its modern form in 1817.",,,"Amnesty (from the Ancient Greek ἀμνηστία, amnestia, ""forgetfulness, passing over"") is defined as ""A pardon extended by the government to a group or class of people, usually for a political offense; the act of a sovereign power officially forgiving certain classes of people who are subject to trial but have not yet been convicted.""","After Melzi's  manuscript was rediscovered in the Vatican Library, the treatise was published in its modern form in 1817."
,"The carrot in this context could be the promise of economic or diplomatic aid between nations, while the stick might be the threat of military action.",,,"Amnesties, which in the United Kingdom may be granted by the crown or by an act of Parliament, were formerly usual on coronations and similar occasions, but are chiefly exercised towards associations of political criminals, and are sometimes granted absolutely, though more frequently there are certain specified exceptions.","The carrot in this context could be the promise of economic or diplomatic aid between nations, while the stick might be the threat of military action."
,The Akkadian Empire () was the first ancient empire of Mesopotamia after the long-lived civilization of Sumer.,,,"Thus, in the case of the earliest recorded amnesty, that of Thrasybulus at Athens, the thirty tyrants and a few others were expressly excluded from its operation; and the amnesty proclaimed on the restoration of Charles II of England did not extend to those who had taken part in the execution of his father.",The Akkadian Empire () was the first ancient empire of Mesopotamia after the long-lived civilization of Sumer.
,It was centered in the city of Akkad () and its surrounding region.,,,"Other famous amnesties include: Napoleon's amnesty of March 13, 1815, from which thirteen eminent persons, including Talleyrand, were exempt; the Prussian amnesty of August 10, 1840; the general amnesty proclaimed by the emperor Franz Josef I of Austria in 1857; the general amnesty granted by President of the United States, Andrew Johnson, after the American Civil War (1861–1865), in 1868, and the French amnesty of 1905.",It was centered in the city of Akkad () and its surrounding region.
,The empire united Akkadian and Sumerian speakers under one rule.,,,"Amnesty in U.S. politics in 1872 meant restoring the right to vote and hold office to ex-Confederates, which was achieved by act of Congress.",The empire united Akkadian and Sumerian speakers under one rule.
,"Under Sargon and his successors, the Akkadian language was briefly imposed on neighboring conquered states such as Elam and Gutium.",,,Prof. Anatoly Zubkov had published over sixty works on the various problems of the physiology and pathology of the heart and the nervous and endocrine control of functions.,"Under Sargon and his successors, the Akkadian language was briefly imposed on neighboring conquered states such as Elam and Gutium."
,"Akkad is sometimes regarded as the first empire in history, though the meaning of this term is not precise, and there are earlier Sumerian claimants.",,,He was the first to translate classic works by Ivan Sechenov into English.,"Akkad is sometimes regarded as the first empire in history, though the meaning of this term is not precise, and there are earlier Sumerian claimants."
,A United Nations Secretary-General selection was held in October 2016 to choose the ninth secretary-general of the United Nations to succeed Ban Ki-moon from 1 January 2017.,,,Behaviorism is a systematic approach to understanding the behavior of humans and other animals.,A United Nations Secretary-General selection was held in October 2016 to choose the ninth secretary-general of the United Nations to succeed Ban Ki-moon from 1 January 2017.
,Six straw polls were held in the Security Council from 21 July 2016 to 5 October 2016.,,,"It assumes that behavior is either a reflex evoked by the pairing of certain antecedent stimuli in the environment, or a consequence of that individual's history, including especially reinforcement and punishment contingencies, together with the individual's current motivational state and controlling stimuli.",Six straw polls were held in the Security Council from 21 July 2016 to 5 October 2016.
,"António Guterres of Portugal led the polling in every round, finishing the last round with 13 'encourage' votes, 0 'discourage' votes, and 2 abstentions.",,,"Although behaviorists generally accept the important role of heredity in determining behavior, they focus primarily on environmental events.","António Guterres of Portugal led the polling in every round, finishing the last round with 13 'encourage' votes, 0 'discourage' votes, and 2 abstentions."
,"On 6 October 2016, the Security Council unanimously recommended Guterres to the General Assembly, which formally selected him by acclamation on 13 October 2016.The 2016 selection was much more open than previous selections, with public nominations being sought and candidates participating in televised debates.",,,"Behaviorism emerged in the early 1900s as a reaction to depth psychology and other traditional forms of psychology, which often had difficulty making predictions that could be tested experimentally, but derived from earlier research in the late nineteenth century, such as when Edward Thorndike pioneered the law of effect, a procedure that involved the use of consequences to strengthen or weaken behavior.","On 6 October 2016, the Security Council unanimously recommended Guterres to the General Assembly, which formally selected him by acclamation on 13 October 2016.The 2016 selection was much more open than previous selections, with public nominations being sought and candidates participating in televised debates."
,"Women and Eastern Europeans were favoured, as no woman had ever served as secretary-general, and the Eastern European Group was the only one of the UN Regional Groups never to have held the office.",,,"With a 1924 publication, John B. Watson devised methodological behaviorism, which rejected introspective methods and sought to understand behavior by only measuring observable behaviors and events.","Women and Eastern Europeans were favoured, as no woman had ever served as secretary-general, and the Eastern European Group was the only one of the UN Regional Groups never to have held the office."
,"Cognitive behavioral therapy (CBT) is a psycho-social intervention that aims to reduce symptoms of various mental health conditions, primarily depression and anxiety disorders.",,,"While Watson and Ivan Pavlov investigated how (conditioned) neutral stimuli elicit reflexes in respondent conditioning, Skinner assessed the reinforcement histories of the discriminative (antecedent) stimuli that emits behavior; the technique became known as operant conditioning.","Cognitive behavioral therapy (CBT) is a psycho-social intervention that aims to reduce symptoms of various mental health conditions, primarily depression and anxiety disorders."
,Cognitive behavioral therapy is one of the most effective means of treatment for substance abuse and co-occurring mental health disorders.,,,"The application of radical behaviorism—known as applied behavior analysis—is used in a variety of contexts, including, for example, applied animal behavior and organizational behavior management to treatment of mental disorders, such as autism and substance abuse.",Cognitive behavioral therapy is one of the most effective means of treatment for substance abuse and co-occurring mental health disorders.
,"CBT focuses on challenging and changing cognitive distortions (such as thoughts, beliefs, and attitudes) and their associated behaviors to improve emotional regulation and develop personal coping strategies that target solving current problems.",,,"In addition, while behaviorism and cognitive schools of psychological thought do not agree theoretically, they have complemented each other in the cognitive-behavior therapies, which have demonstrated utility in treating certain pathologies, including simple phobias, PTSD, and mood disorders.","CBT focuses on challenging and changing cognitive distortions (such as thoughts, beliefs, and attitudes) and their associated behaviors to improve emotional regulation and develop personal coping strategies that target solving current problems."
,"Though it was originally designed to treat depression, its uses have been expanded to include the treatment of many mental health conditions, including anxiety, substance use disorders, marital problems, and eating disorders.",,,Acropora is a genus of small polyp stony coral in the phylum Cnidaria.,"Though it was originally designed to treat depression, its uses have been expanded to include the treatment of many mental health conditions, including anxiety, substance use disorders, marital problems, and eating disorders."
,"It is different from historical approaches to psychotherapy, such as the psychoanalytic approach where the therapist looks for the unconscious meaning behind the behaviors, and then formulates a diagnosis.",,,Acropora species are some of the major reef corals responsible for building the immense calcium carbonate substructure that supports the thin living skin of a reef.,"It is different from historical approaches to psychotherapy, such as the psychoanalytic approach where the therapist looks for the unconscious meaning behind the behaviors, and then formulates a diagnosis."
,"Instead, CBT is a ""problem-focused"" and ""action-oriented"" form of therapy, meaning it is used to treat specific problems related to a diagnosed mental disorder.",,,"Aplysia () is a genus of medium-sized to extremely large sea slugs, specifically sea hares, which are a kind of marine gastropod mollusk.","Instead, CBT is a ""problem-focused"" and ""action-oriented"" form of therapy, meaning it is used to treat specific problems related to a diagnosed mental disorder."
,The therapist's role is to assist the client in finding and practicing effective strategies to address the identified goals and to alleviate symptoms of the disorder.,,,These benthic herbivorous creatures can become rather large compared with most other mollusks.,The therapist's role is to assist the client in finding and practicing effective strategies to address the identified goals and to alleviate symptoms of the disorder.
,"Some research suggests that CBT is most effective when combined with medication for treating mental disorders, such as major depressive disorder.",,,"Following the lead of Eric R. Kandel, the genus has been studied as a model organism by neurobiologists, because its gill and siphon withdrawal reflex, as studied in Aplysia californica,  is mediated by electrical synapses, which allow several neurons to fire synchronously.","Some research suggests that CBT is most effective when combined with medication for treating mental disorders, such as major depressive disorder."
,"CBT is recommended as the first line of treatment for the majority of psychological disorders in children and adolescents, including aggression and conduct disorder.",,,This quick neural response is necessary for a speedy reaction to danger by the animal.,"CBT is recommended as the first line of treatment for the majority of psychological disorders in children and adolescents, including aggression and conduct disorder."
,Researchers have found that other bona fide therapeutic interventions were equally effective for treating certain conditions in adults.,,,"Aplysia has only about 20,000 neurons, making it a favorite subject for investigation by neuroscientists.",Researchers have found that other bona fide therapeutic interventions were equally effective for treating certain conditions in adults.
,"Along with interpersonal psychotherapy (IPT), CBT is recommended in treatment guidelines as a psychosocial treatment of choice.",,,"Also, the 'tongue' on the underside is controlled by only two neurons, which allowed complete mapping of the innervation network to be carried out.","Along with interpersonal psychotherapy (IPT), CBT is recommended in treatment guidelines as a psychosocial treatment of choice."
,"Airavatesvara Temple is a Hindu temple of Dravidian architecture located in Kumbakonam, Thanjavur District in the South Indian state of Tamil Nadu.",,,Six judges of the International Criminal Court were elected during the 10th session of the Assembly of States Parties to the Rome Statute of the International Criminal Court in New York between 12 and 21 December 2011.,"Airavatesvara Temple is a Hindu temple of Dravidian architecture located in Kumbakonam, Thanjavur District in the South Indian state of Tamil Nadu."
,The temple is dedicated to Shiva.,,,"In the set of triennial elections, the General Assembly and the Security Council concurrently elect five judges to the Court for nine-year terms, in this case beginning on 6 February 2015.",The temple is dedicated to Shiva.
,Shiva's consort has a dedicated shrine called the Periya Nayaki Amman temple.,,,"From the eight candidates, the five winners were Giorgio Gaja (Italy), Hisashi Owada (Japan), Peter Tomka (Slovakia), Xue Hanqin (China) and Julia Sebutinde (Uganda).",Shiva's consort has a dedicated shrine called the Periya Nayaki Amman temple.
,This is a detached temple situated to the north of the Airavateshvarar temple.,,,"Andriy Tykhonovych Slyusarchuk (Ukrainian: Андрі́й Ти́хонович Слюсарчу́к, born 10 May 1971) is a Ukrainian mnemonist who has claimed to be a general aviation pilot, a psychotherapist, a Doctor of Science in medicine, a psychiatrist, a psychologist and a neurosurgeon.",This is a detached temple situated to the north of the Airavateshvarar temple.
,This might have been a part of the main temple when the outer courts were complete.,,,He performed brain surgery throughout Ukraine in state and municipal hospitals.,This might have been a part of the main temple when the outer courts were complete.
,"At present, parts of the temple such as the gopuram is in ruins, and the main temple and associated shrines stand alone.",,,"Slyusarchuk was employed by the V. Chornovol Lviv State Institute of Modern Technology and Management, the Kyiv National University of Construction and Architecture, the P.L.","At present, parts of the temple such as the gopuram is in ruins, and the main temple and associated shrines stand alone."
,It has two sun dials namely morning and evening sun dials which  can be seen as wheels of the chariot.,,,"Shupyk National Medical Academy of Postgraduate Education, and the A. P. Romodanov Institute of Neurosurgery, he lectured at the Lviv Polytechnic, and worked at the government of Ukraine as an adviser to Oleksandr Turchynov.He claimed to have set several world records in mnemonics by memorizing data and figures (such as pi) and performing complex calculations in his mind.",It has two sun dials namely morning and evening sun dials which  can be seen as wheels of the chariot.
,"The temple continues to attract large gatherings of Hindu pilgrims every year during Magha, while some of the images such as those of Durga and Shiva are part of special pujas.",,,"Because of this, he is known as ""Doctor Pi"".Slyusarchuk defrauded two Ukrainian presidents: Viktor Yushchenko and Viktor Yanukovych.","The temple continues to attract large gatherings of Hindu pilgrims every year during Magha, while some of the images such as those of Durga and Shiva are part of special pujas."
,"Amnesty (from the Ancient Greek ἀμνηστία, amnestia, ""forgetfulness, passing over"") is defined as ""A pardon extended by the government to a group or class of people, usually for a political offense; the act of a sovereign power officially forgiving certain classes of people who are subject to trial but have not yet been convicted.""",,,"The Verkhovna Rada (the Ukrainian Parliament) referred to his activities as ""the largest-scale fraud in Ukraine's 20 years of independence"".","Amnesty (from the Ancient Greek ἀμνηστία, amnestia, ""forgetfulness, passing over"") is defined as ""A pardon extended by the government to a group or class of people, usually for a political offense; the act of a sovereign power officially forgiving certain classes of people who are subject to trial but have not yet been convicted."""
,"Though the term general pardon has a similar definition, an amnesty constitutes more than a pardon, in so much as it obliterates all legal remembrance of the offense.",,,"On 14 February 2014, the Sykhiv Raion Court sentenced Slyusarchuk to eight years in prison.","Though the term general pardon has a similar definition, an amnesty constitutes more than a pardon, in so much as it obliterates all legal remembrance of the offense."
,"Amnesties, which in the United Kingdom may be granted by the crown or by an act of Parliament, were formerly usual on coronations and similar occasions, but are chiefly exercised towards associations of political criminals, and are sometimes granted absolutely, though more frequently there are certain specified exceptions.",,,"It can have three different causes:

a low level of attention (""blanking"" or ""zoning out"")
intense attention to a single object of focus (hyperfocus) that makes a person oblivious to events around them;
unwarranted distraction of attention from the object of focus by irrelevant thoughts or environmental events.Absent-mindedness is a mental condition in which the subject experiences low levels of attention and frequent distraction.","Amnesties, which in the United Kingdom may be granted by the crown or by an act of Parliament, were formerly usual on coronations and similar occasions, but are chiefly exercised towards associations of political criminals, and are sometimes granted absolutely, though more frequently there are certain specified exceptions."
,"Thus, in the case of the earliest recorded amnesty, that of Thrasybulus at Athens, the thirty tyrants and a few others were expressly excluded from its operation; and the amnesty proclaimed on the restoration of Charles II of England did not extend to those who had taken part in the execution of his father.",,,"Absent-mindedness is not a diagnosed condition but rather a state people experience in their daily lives from a variety of different causes including boredom, sleepiness, or focus on internal thoughts instead of external surroundings.","Thus, in the case of the earliest recorded amnesty, that of Thrasybulus at Athens, the thirty tyrants and a few others were expressly excluded from its operation; and the amnesty proclaimed on the restoration of Charles II of England did not extend to those who had taken part in the execution of his father."
,"Amnesty in U.S. politics in 1872 meant restoring the right to vote and hold office to ex-Confederates, which was achieved by act of Congress.",,,"In addition to absent-mindedness leading to an array of consequences affecting daily life, it can have more severe, long-term problems.","Amnesty in U.S. politics in 1872 meant restoring the right to vote and hold office to ex-Confederates, which was achieved by act of Congress."
,"Those were true amnesties, pardoning past violations without changing the laws violated.",,,Alba Teresa Rojo Cama (28 April 1961 – 16 August 2016) was a Mexican sculptor known for her geometric artworks.,"Those were true amnesties, pardoning past violations without changing the laws violated."
,He held the chair of physiology in the Kishinev Medical Institute.,,,"It struck the reef late in the afternoon of 3 April, scraping along the reef for a considerable distance and creating the longest known grounding scar on the Great Barrier Reef.",He held the chair of physiology in the Kishinev Medical Institute.
,Prof. Anatoly Zubkov had published over sixty works on the various problems of the physiology and pathology of the heart and the nervous and endocrine control of functions.,,,Tugs were sent to remove the ship which was feared would break apart in rough seas.,Prof. Anatoly Zubkov had published over sixty works on the various problems of the physiology and pathology of the heart and the nervous and endocrine control of functions.
,He was the first to translate classic works by Ivan Sechenov into English.,,,"Eventually, the vessel was refloated and taken to Hervey Bay.",He was the first to translate classic works by Ivan Sechenov into English.
