original_text,shared_sentences,unique_to_spacy,unique_to_nltk,nltk_segmentation,spacy_segmentation
,"The ""signal"" at a connection is a real number, and the output of each neuron is computed by some non-linear function of the sum of its inputs.","After 40 hours of slow progress across Lake Superior, 115 broke away from Colgate Hoyt at 6:05 a.m., on December 13.",,"The CNS is so named because the brain integrates the received information and coordinates and influences the activity of all parts of the bodies of bilaterally symmetric and triploblastic animals—that is, all multicellular animals except sponges and diploblasts.","The ""signal"" at a connection is a real number, and the output of each neuron is computed by some non-linear function of the sum of its inputs."
,The connections are called edges.,"Colgate Hoyt searched for her for four hours, but due to the scarcity of fuel on board, she was forced to proceed to Sault Ste.",,It is a structure composed of nervous tissue positioned along the rostral (nose end) to caudal (tail end) axis of the body and may have an enlarged section at the rostral end which is a brain.,The connections are called edges.
,Neurons and edges typically have a weight that adjusts as learning proceeds.,"Her crew made it to shore in a makeshift raft, walking for several days, before being located by crew from the Canadian Pacific Railway.
",,"Only arthropods, cephalopods and vertebrates have a true brain (precursor structures exist in onychophorans, gastropods and lancelets).",Neurons and edges typically have a weight that adjusts as learning proceeds.
,The weight increases or decreases the strength of the signal at a connection.,"Focalization, concentration, of consciousness are of its essence.",,"The rest of this article exclusively discusses the vertebrate central nervous system, which is radically distinct from all other animals.",The weight increases or decreases the strength of the signal at a connection.
,"Typically, neurons are aggregated into layers.","Attention is manifested by an attentional bottleneck, in terms of the amount of data the brain can process each second; for example, in human vision, only less than 1% of the visual input data (at around one megabyte per second) can enter the bottleneck, leading to inattentional blindness.",,It was the rotational turn of the Asia-Pacific Group to preside over the session.,"Typically, neurons are aggregated into layers."
,Different layers may perform different transformations on their inputs.,"Attention remains a crucial area of investigation within education, psychology, neuroscience, cognitive neuroscience, and neuropsychology.",,Peter Thomson was elected with 94 votes for and 90 votes against.,Different layers may perform different transformations on their inputs.
,"Signals travel from the first layer (the input layer), to the last layer (the output layer), possibly after traversing the layers multiple times.",Attention also varies across cultures.,,"This was the first time since 2012 that there was no consensus candidate from the regional groupings, thus invoking a secret ballot vote.","Signals travel from the first layer (the input layer), to the last layer (the output layer), possibly after traversing the layers multiple times."
,"Arthur Paul Shimamura (June 26, 1954 – October 6, 2020) was a professor of psychology and faculty member of the Helen Wills Neuroscience Institute at the University of California, Berkeley.",,,"It is located on Akumal Bay and Half Moon Bay on the site of a former coconut plantation in Tulum Municipality in the state of Quintana Roo, and is part of the Riviera Maya area.","Arthur Paul Shimamura (June 26, 1954 – October 6, 2020) was a professor of psychology and faculty member of the Helen Wills Neuroscience Institute at the University of California, Berkeley."
,His research focused on the neural basis of human memory and cognition.,,,"The 2010 census showed a population of 1,310 inhabitants.Akumal is famous as a destination for snorkeling, where visitors can swim with endangered green sea turtles, who visit the shallow bay to feed on sea grass.",His research focused on the neural basis of human memory and cognition.
,"He received his BA in experimental psychology from the University of California, Santa Barbara in 1977 and his PhD in cognitive psychology from the University of Washington in 1982.",,,The popularity of snorkeling has put environmental pressure on the fragile habitat.,"He received his BA in experimental psychology from the University of California, Santa Barbara in 1977 and his PhD in cognitive psychology from the University of Washington in 1982."
,"He was a post-doctoral fellow in the laboratory of Larry Squire, where he studied amnesic patients.",,,"Acheulean (; also Acheulian and Mode II), from the French acheuléen after the type site of Saint-Acheul, is an archaeological industry of stone tool manufacture characterized by the distinctive oval and pear-shaped ""hand axes"" associated with Homo erectus and derived species such as Homo heidelbergensis.","He was a post-doctoral fellow in the laboratory of Larry Squire, where he studied amnesic patients."
,"In 1989, Shimamura began his professorship at UC Berkeley.",,,"Acheulean tools were produced during the Lower Palaeolithic era across Africa and much of West Asia, South Asia, East Asia and Europe, and are typically found with Homo erectus remains.","In 1989, Shimamura began his professorship at UC Berkeley."
,"In 2008, Shimamura received a John Simon Guggenheim Memorial Foundation fellowship to explore links between art, mind, and brain.",,,The Acheulean includes at least the early part of the Middle Paleolithic.,"In 2008, Shimamura received a John Simon Guggenheim Memorial Foundation fellowship to explore links between art, mind, and brain."
,The central nervous system (CNS) is the part of the nervous system consisting primarily of the brain and spinal cord.,,,This is the most intact of the three Amtracks remaining on Guam from the 850 that participated in the battle.,The central nervous system (CNS) is the part of the nervous system consisting primarily of the brain and spinal cord.
,"The CNS is so named because the brain integrates the received information and coordinates and influences the activity of all parts of the bodies of bilaterally symmetric and triploblastic animals—that is, all multicellular animals except sponges and diploblasts.",,,It was re-surveyed by maritime archaeological field schools conducted from 2009 to 2012.It is administratively part of the Agat Unit of War in the Pacific National Historical Park.,"The CNS is so named because the brain integrates the received information and coordinates and influences the activity of all parts of the bodies of bilaterally symmetric and triploblastic animals—that is, all multicellular animals except sponges and diploblasts."
,"The rest of this article exclusively discusses the vertebrate central nervous system, which is radically distinct from all other animals.",,,"Agriculture was the key development in the rise of sedentary human civilization, whereby farming of domesticated species created food surpluses that enabled people to live in cities.","The rest of this article exclusively discusses the vertebrate central nervous system, which is radically distinct from all other animals."
,An indirect presidential election was held to choose the President of the United Nations General Assembly on 13 June 2016 to replace Mogens Lykketoft and preside over the Seventy-first session of the United Nations General Assembly.,,,"While humans started gathering grains at least 105,000 years ago, nascent farmers only began planting them around 11,500 years ago.",An indirect presidential election was held to choose the President of the United Nations General Assembly on 13 June 2016 to replace Mogens Lykketoft and preside over the Seventy-first session of the United Nations General Assembly.
,It was the rotational turn of the Asia-Pacific Group to preside over the session.,,,"Sheep, goats, pigs and cattle were domesticated around 10,000 years ago.",It was the rotational turn of the Asia-Pacific Group to preside over the session.
,Peter Thomson was elected with 94 votes for and 90 votes against.,,,Plants were independently cultivated in at least 11 regions of the world.,Peter Thomson was elected with 94 votes for and 90 votes against.
,"This was the first time since 2012 that there was no consensus candidate from the regional groupings, thus invoking a secret ballot vote.",,,"In the twentieth century, industrial agriculture based on large-scale monocultures came to dominate agricultural output.","This was the first time since 2012 that there was no consensus candidate from the regional groupings, thus invoking a secret ballot vote."
,The Atkinson–Shiffrin model (also known as the multi-store model or modal model) is a model of memory proposed in 1968 by Richard Atkinson and Richard Shiffrin.,,,The largest one percent of farms in the world are greater than 50 hectares and operate more than 70 percent of the world's farmland.,The Atkinson–Shiffrin model (also known as the multi-store model or modal model) is a model of memory proposed in 1968 by Richard Atkinson and Richard Shiffrin.
,"Akumal is a small beach-front tourist resort community in Mexico, located 100 km (62 mi) south of Cancún, between the towns of Playa del Carmen and  Tulum.",,,"Global agricultural production amounts to approximately 11 billion tonnes of food, 32 million tonnes of natural fibres and 4 billion m3 of wood.","Akumal is a small beach-front tourist resort community in Mexico, located 100 km (62 mi) south of Cancún, between the towns of Playa del Carmen and  Tulum."
,"It is located on Akumal Bay and Half Moon Bay on the site of a former coconut plantation in Tulum Municipality in the state of Quintana Roo, and is part of the Riviera Maya area.",,,"However, around 14 percent of the world's food is lost from production before reaching the retail level.Modern agronomy, plant breeding, agrochemicals such as pesticides and fertilizers, and technological developments have sharply increased crop yields, but also contributed to ecological and environmental damage.","It is located on Akumal Bay and Half Moon Bay on the site of a former coconut plantation in Tulum Municipality in the state of Quintana Roo, and is part of the Riviera Maya area."
,The popularity of snorkeling has put environmental pressure on the fragile habitat.,,,"Agriculture is both a cause of and sensitive to environmental degradation, such as biodiversity loss, desertification, soil degradation, and climate change, all of which can cause decreases in crop yield.",The popularity of snorkeling has put environmental pressure on the fragile habitat.
,"Acheulean tools were produced during the Lower Palaeolithic era across Africa and much of West Asia, South Asia, East Asia and Europe, and are typically found with Homo erectus remains.",,,"In psychology, aversives are unpleasant stimuli that induce changes in behavior via negative reinforcement or positive punishment.","Acheulean tools were produced during the Lower Palaeolithic era across Africa and much of West Asia, South Asia, East Asia and Europe, and are typically found with Homo erectus remains."
,The Acheulean includes at least the early part of the Middle Paleolithic.,,,"Aversives can vary from being slightly unpleasant or irritating to physically, psychologically and/or emotionally damaging.",The Acheulean includes at least the early part of the Middle Paleolithic.
,"Its end is not well defined, depending on whether Sangoan (also known as ""Epi-Acheulean"") is included, it may be taken to last until as late as 130,000 years ago.",,,"It is not the level of unpleasantness or intention that matter, but rather the level of effectiveness the unpleasant event has on changing (decreasing) behavior that defines something as aversive.","Its end is not well defined, depending on whether Sangoan (also known as ""Epi-Acheulean"") is included, it may be taken to last until as late as 130,000 years ago."
,"In Europe and Western Asia, early Neanderthals adopted Acheulean technology, transitioning to Mousterian by about 160,000 years ago.",,,Al Munassir was an amphibious warfare vessel operated by the Royal Navy of Oman.,"In Europe and Western Asia, early Neanderthals adopted Acheulean technology, transitioning to Mousterian by about 160,000 years ago."
,This particular vehicle does not appear to exhibit significant war damage.,,,Milner is a professor in the Department of Neurology and Neurosurgery at McGill University and a professor of Psychology at the Montreal Neurological Institute.,This particular vehicle does not appear to exhibit significant war damage.
,This is the most intact of the three Amtracks remaining on Guam from the 850 that participated in the battle.,,,"As of 2020, she holds more than 25 honorary degrees and she continued to work in her nineties.",This is the most intact of the three Amtracks remaining on Guam from the 850 that participated in the battle.
,It was re-surveyed by maritime archaeological field schools conducted from 2009 to 2012.It is administratively part of the Agat Unit of War in the Pacific National Historical Park.,,,Her current work covers many aspects of neuropsychology including her lifelong interest in the involvement of the temporal lobes in episodic memory.,It was re-surveyed by maritime archaeological field schools conducted from 2009 to 2012.It is administratively part of the Agat Unit of War in the Pacific National Historical Park.
,The Amtrac is the occasional topic of National Park Service ranger presentations.,,,She is sometimes referred to as the founder of neuropsychology and has been essential in its development.,The Amtrac is the occasional topic of National Park Service ranger presentations.
,The submerged wreck was listed on the National Register of Historic Places in 2011.,,,"She received the Balzan Prize for Cognitive Neuroscience in 2009, and the Kavli Prize in Neuroscience, together with John O'Keefe, and Marcus E. Raichle, in 2014.",The submerged wreck was listed on the National Register of Historic Places in 2011.
,"Agriculture encompasses crop and livestock production, aquaculture, fisheries and forestry for food and non-food products.",,,She turned 100 in July 2018 and at the time was still overseeing the work of researchers.,"Agriculture encompasses crop and livestock production, aquaculture, fisheries and forestry for food and non-food products."
,"Agriculture was the key development in the rise of sedentary human civilization, whereby farming of domesticated species created food surpluses that enabled people to live in cities.",,,The 22nd parallel south is a circle of latitude that is 22 degrees south of the Earth's equatorial plane.,"Agriculture was the key development in the rise of sedentary human civilization, whereby farming of domesticated species created food surpluses that enabled people to live in cities."
,"While humans started gathering grains at least 105,000 years ago, nascent farmers only began planting them around 11,500 years ago.",,,"It crosses the Atlantic Ocean, Africa, the Indian Ocean, Australasia, the Pacific Ocean and South America.","While humans started gathering grains at least 105,000 years ago, nascent farmers only began planting them around 11,500 years ago."
,"Sheep, goats, pigs and cattle were domesticated around 10,000 years ago.",,,"A section of the border between Namibia and Botswana, and two sections of the border between Bolivia and Argentina are defined by the parallel.","Sheep, goats, pigs and cattle were domesticated around 10,000 years ago."
,Plants were independently cultivated in at least 11 regions of the world.,,,"The 2016 United Nations Security Council election was held on 28 June during the 70th session of the United Nations General Assembly, held at United Nations Headquarters in New York City.",Plants were independently cultivated in at least 11 regions of the world.
,"Today, small farms produce about a third of the world's food, but large farms are prevalent.",,,"In accordance with the Security Council's rotation rules, whereby the ten non-permanent UNSC seats rotate among the various regional blocs into which UN member states traditionally divide themselves for voting and representation purposes, the five available seats were allocated as follows:

One for Africa
One for the Asia-Pacific Group
One for Latin America and the Caribbean
Two for the Western European and Others GroupThe five members will serve on the Security Council for the 2017–18 period.","Today, small farms produce about a third of the world's food, but large farms are prevalent."
,The largest one percent of farms in the world are greater than 50 hectares and operate more than 70 percent of the world's farmland.,,,This was the first time a Security Council election was held in the month of June.,The largest one percent of farms in the world are greater than 50 hectares and operate more than 70 percent of the world's farmland.
,"Nearly 40 percent of agricultural land is found on farms larger than 1,000 hectares.",,,"On 18 September 2014, the General Assembly adopted Resolution 68/307 to push the elections back to six months prior to the beginning of the newly elected Council members' terms.","Nearly 40 percent of agricultural land is found on farms larger than 1,000 hectares."
,"Food classes include cereals (grains), vegetables, fruits, cooking oils, meat, milk, eggs, and fungi.",,,This conditioning is intended to cause the patient to associate the stimulus with unpleasant sensations with the intention of quelling the targeted (sometimes compulsive) behavior.,"Food classes include cereals (grains), vegetables, fruits, cooking oils, meat, milk, eggs, and fungi."
,"Global agricultural production amounts to approximately 11 billion tonnes of food, 32 million tonnes of natural fibres and 4 billion m3 of wood.",,,"Aversion therapies can take many forms, for example: placing unpleasant-tasting substances on the fingernails to discourage nail-chewing; pairing the use of an emetic with the experience of alcohol; or pairing behavior with electric shocks of mild to higher intensities.","Global agricultural production amounts to approximately 11 billion tonnes of food, 32 million tonnes of natural fibres and 4 billion m3 of wood."
,"Selective breeding and modern practices in animal husbandry have similarly increased the output of meat, but have raised concerns about animal welfare and environmental damage.",,,The center has been condemned by the United Nations for torture.,"Selective breeding and modern practices in animal husbandry have similarly increased the output of meat, but have raised concerns about animal welfare and environmental damage."
,"Environmental issues include contributions to climate change, depletion of aquifers, deforestation, antibiotic resistance, and other agricultural pollution.",,,"A Treatise on Painting (Trattato della pittura) is a collection of Leonardo da Vinci's writings entered in his notebooks under the general heading ""On Painting"".","Environmental issues include contributions to climate change, depletion of aquifers, deforestation, antibiotic resistance, and other agricultural pollution."
,"Agriculture is both a cause of and sensitive to environmental degradation, such as biodiversity loss, desertification, soil degradation, and climate change, all of which can cause decreases in crop yield.",,,The manuscripts were begun in Milan while Leonardo was under the service of Ludovico Sforza and gathered together by his heir Francesco Melzi.,"Agriculture is both a cause of and sensitive to environmental degradation, such as biodiversity loss, desertification, soil degradation, and climate change, all of which can cause decreases in crop yield."
,"Genetically modified organisms are widely used, although some countries ban them.",,,An abridged version of the treatise was first published in France in 1651.,"Genetically modified organisms are widely used, although some countries ban them."
,"In psychology, aversives are unpleasant stimuli that induce changes in behavior via negative reinforcement or positive punishment.",,,"After Melzi's  manuscript was rediscovered in the Vatican Library, the treatise was published in its modern form in 1817.","In psychology, aversives are unpleasant stimuli that induce changes in behavior via negative reinforcement or positive punishment."
,By applying an aversive immediately before or after a behavior the likelihood of the target behavior occurring in the future is reduced.,,,"The phrase ""carrot and stick"" is a metaphor for the use of a combination of reward and punishment to induce a desired behaviour.In politics, ""carrot or stick"" sometimes refers to the realist concept of soft and hard power.",By applying an aversive immediately before or after a behavior the likelihood of the target behavior occurring in the future is reduced.
,"Aversives can vary from being slightly unpleasant or irritating to physically, psychologically and/or emotionally damaging.",,,"The carrot in this context could be the promise of economic or diplomatic aid between nations, while the stick might be the threat of military action.","Aversives can vary from being slightly unpleasant or irritating to physically, psychologically and/or emotionally damaging."
,"It is not the level of unpleasantness or intention that matter, but rather the level of effectiveness the unpleasant event has on changing (decreasing) behavior that defines something as aversive.",,,The Akkadian Empire () was the first ancient empire of Mesopotamia after the long-lived civilization of Sumer.,"It is not the level of unpleasantness or intention that matter, but rather the level of effectiveness the unpleasant event has on changing (decreasing) behavior that defines something as aversive."
,It was purchased to enable the kingdom to respond to threats to the strategically important Musandam Governorate.,,,The empire united Akkadian and Sumerian speakers under one rule.,It was purchased to enable the kingdom to respond to threats to the strategically important Musandam Governorate.
,"The vessel was launched in 1978 and, after decommissioning, was sunk as an artificial reef in 2003.",,,"The Akkadian Empire exercised influence across Mesopotamia, the Levant, and Anatolia, sending military expeditions as far south as Dilmun and Magan (modern Saudi Arabia, Bahrain, and Oman) in the Arabian Peninsula.The Akkadian Empire reached its political peak between the 24th and 22nd centuries BC, following the conquests by its founder Sargon of Akkad.","The vessel was launched in 1978 and, after decommissioning, was sunk as an artificial reef in 2003."
,It is now a popular diving site.,,,"Under Sargon and his successors, the Akkadian language was briefly imposed on neighboring conquered states such as Elam and Gutium.",It is now a popular diving site.
,Milner is a professor in the Department of Neurology and Neurosurgery at McGill University and a professor of Psychology at the Montreal Neurological Institute.,,,Six straw polls were held in the Security Council from 21 July 2016 to 5 October 2016.,Milner is a professor in the Department of Neurology and Neurosurgery at McGill University and a professor of Psychology at the Montreal Neurological Institute.
,"As of 2020, she holds more than 25 honorary degrees and she continued to work in her nineties.",,,"António Guterres of Portugal led the polling in every round, finishing the last round with 13 'encourage' votes, 0 'discourage' votes, and 2 abstentions.","As of 2020, she holds more than 25 honorary degrees and she continued to work in her nineties."
,Her current work covers many aspects of neuropsychology including her lifelong interest in the involvement of the temporal lobes in episodic memory.,,,"On 6 October 2016, the Security Council unanimously recommended Guterres to the General Assembly, which formally selected him by acclamation on 13 October 2016.The 2016 selection was much more open than previous selections, with public nominations being sought and candidates participating in televised debates.",Her current work covers many aspects of neuropsychology including her lifelong interest in the involvement of the temporal lobes in episodic memory.
,She is sometimes referred to as the founder of neuropsychology and has been essential in its development.,,,"Women and Eastern Europeans were favoured, as no woman had ever served as secretary-general, and the Eastern European Group was the only one of the UN Regional Groups never to have held the office.",She is sometimes referred to as the founder of neuropsychology and has been essential in its development.
,"She received the Balzan Prize for Cognitive Neuroscience in 2009, and the Kavli Prize in Neuroscience, together with John O'Keefe, and Marcus E. Raichle, in 2014.",,,"However, the two campaigns offset each other, and the selection was won by the only candidate who was neither female nor from Eastern Europe.","She received the Balzan Prize for Cognitive Neuroscience in 2009, and the Kavli Prize in Neuroscience, together with John O'Keefe, and Marcus E. Raichle, in 2014."
,She turned 100 in July 2018 and at the time was still overseeing the work of researchers.,,,"Cognitive behavioral therapy (CBT) is a psycho-social intervention that aims to reduce symptoms of various mental health conditions, primarily depression and anxiety disorders.",She turned 100 in July 2018 and at the time was still overseeing the work of researchers.
